<?xml version="1.0" encoding="UTF-8"?>
<Betriebliste xmlns:xsi="http://www.w3.org/2001/XMLSchema-instance" xsi:noNamespaceSchemaLocation="../XSD/Betriebliste.xsd">
  <Betrieb>
    <Betriebs_ID>1</Betriebs_ID>
    <Betriebname>Beuek</Betriebname>
    <Adresse>
      <strasse>Neutor</strasse>
      <Hausnummer>2</Hausnummer>
      <PLZ>12345</PLZ>
    </Adresse>
    <Art_des_Betriebes>Restaurant</Art_des_Betriebes>
  </Betrieb>
   <Betrieb>
    <Betriebs_ID>2</Betriebs_ID>
    <Betriebname>Knaller</Betriebname>
    <Adresse>
      <strasse>Lilysallee</strasse>
      <Hausnummer>933</Hausnummer>
      <PLZ>12345</PLZ>
    </Adresse>
    <Art_des_Betriebes>Grosshandel</Art_des_Betriebes>
  </Betrieb>
</Betriebliste>
